,ID,Text,Truth,Avg_sent,TTR,Avg_word,Hapax,Yules
62,62.0,"Утро пятницы - солнечное, но холодное. На завтрак стандартные бутерброды и опять метро. Наконец сегодня должен заниматься. Во вторник пролетел, так как непонятно почему со мной пришел еще один человек. Вождение на автомате перешел с механики - в Москве на механике делать нечего. Друзья посоветовали, ну я и поменял автомобили. В 10 часов как и договаривались меня забрали и прямиком на площадку жесть - насколько все проще. Полуторачасовые занятия прошли на ура, настроение поднялось. В метро, по пути в универ наткнулся на старую знакомую, но это не самое интересное. Днем ранее я дорисовал ее портрет, но именно в тот момент у меня не было с собой сумки, так как я не захотел переть с ней вечером на футбол. Но знакомая тоже ехала в универ, так что в итоге я показал ей свое творение. Она была крайне удивлена тем, что я оказывается еще и рисую и взяла рисунок себе. Возможно повесит его на том самом холодильнике. Не очень хорошая новость - я понял почему мне урезали стипендию. Курсовая всему виной. Я как-то не обратил на нее должного внимания - вот она и вылезла. Но тут же эта новость сменяется другой служебка на премирование за хорошую работу, так что видимо на самом деле - все, что ни делается - все к лучшему.  ",1,13.277777777777779,0.6276150627615062,4.2384937238493725,0.8533333333333334,386.22222222222223
63,63.0,"Я давно мечтаю о прыжке с парашютом. И вот этот день наступил. Это было субботнее весеннее утро. Небо было голубое-голубое, солнце светило очень ярко. Мы с друзьями договорились встретиться в 12 часов на пункте назначения. И вот я собралась и отправилась в путь. Приехав, ребята уже ждали меня. И вот началась посадка. Меня жутко трусило, и у меня даже возникло желание все прервать, но я переборола себя и все-таки осталась. Руководитель сказал надеть парашюты. И вот мы поднялись на необходимую высоту, и до моего прыжка оставалось максимум 5 минут.И вот, эти 5 минут пролетели, как одна секунда.И вот я стою на краю самолета и прыгаю. Ааааа, взрыв адреналина. И все я на земле, всего лишь какая-то минута, зато какие незабываемые ощущения. Мне безумно понравилось, и я с удовольствием сделаю это еще раз. ",1,10.466666666666667,0.643312101910828,4.305732484076433,0.8613861386138614,543.0840113714341
64,64.0,"Мой день рождения прошел отлично. Были поздравления от самых близких мне людей. С утра пораньше я встала, умылась, начала приводить себя в порядок, чтобы встретиться с лучшей подругой.. Мы встретились с подругой. Подруга подарила мне подарки, которые мне были приятны. После встречи с подругой мы пошли в кафе. Мы посидели, посмеялись. После того как мы посидели в кафе мы сели в мою машину и поехали кататься на машине.  Останавливались в разных местах мы делали фотографии. Эти фотографии выходили очень удачными. После данной прогулки я отвезла подругу домой.  Когда отвезла свою подругу домой я решила встретиться со своим молодым человеком. Молодой человек порадовал своим присутствием и подарил самые любимые духи, которые мне понравились. В итоге самый праздничный день прошел на ура. Мне было приятно получать подарки от любимых мне людей. В конце дня я пришла домой и легла спать до следующего дня. ",1,9.529411764705882,0.6049382716049383,4.722222222222222,0.7244897959183674,501.87421907538527
65,65.0,"За день до эксперимента я проснулась позавтракала и начала собираться в институт на учебу. Приехав в институт я просидела на всех 4 парах - при этом они были не интересными. Отсидев четыре пары в универе я встретилась с сестрой. Вместе с сестрой мы решили пойти в ресторан и отлично там поужинали. После этого я попрощалась с сестрой и поехала на работу- работаю я в ночную смену в банке.  На работе ночь прошла на ура. Клиентов было мало и я смогла пару часов отдохнуть, затем несколько часов меня обучали новым продуктам банка и это было довольно интересно. После того как ночная смена закончилась я поехала в ТЦ, где прошлась по магазинам и купила себе отличное платье (как раз для поездки домой). После встретилась с подругой позавтракала и приехала в университет на две пары. И теперь сижу и делаю ваш ""тест"".",1,15.5,0.6709677419354839,4.367741935483871,0.8365384615384616,354.10502958579883
66,66.0,"Тема:""Как я провел вчерашний день"". Наступило утро. Встаю я легко, потому что ложусь рано. Собравшись на учебу, средним темпом выдвигаюсь в путь. Дойдя до метро, видя вокруг себя ""заведенные лица"" людей, спускаюсь к ""самому гениальному"" изобретению человечества. Закрыв глаза и пытаясь уснуть и пытаясь отвести от себя взгляды ""озлобленных"" все тех же людей. засыпаю и еду 50 минут до конечной. Приехав в институт, поздоровавшись со всеми и увидя доброжелательные взгляды своих ""коллег по цеху"" начинаю вникать в общеобразовательный процесс. С интересом вслушиваюсь в слова преподавателя, перевариваю информацию у себя в мозге, что-то даже записываю. На самом деле, стараюсь извлечь максимальную пользу от проведенного в ВУЗе времени. Закончилась последняя пара. Вся группа отправляется домой с чувством выполненного долга (перед родителями, которые оплачивают их обучение). Я же также испытываю определенное удовлетворение от проведенного времени. Возвращаясь домой, ни о чем не думаю, стараюсь ""отключиться"" от всего. Сходив в спортзал, увидевшись с приятными мне людьми, неторопясь по-доброму подустав, направляюсь домой. Дома веду себя естественно, по-простому. Стараюсь не переносить отрицательные эмоции на своих близких. Стараюсь завершить день на позитивной ноте, не думая о плохом и не включаю телевизор. И вот конец минувшего дня. Смотря в потолок, прокручивая весь день в 3-х минутном мозговом ролике, медленно засыпаю...",1,12.75,0.6431372549019608,4.87843137254902,0.8475609756097561,374.40511600237954
67,67.0,"С утра мы с моим молодым человеком проснулись, позавтракали и поехали гулять в парк. В этот день в парках Москвы было очень людно и весело. Мы гуляли до вечера, а потом поехали домой. Дома поужинали и провели остаток вечера в обнимку перед телевизором. Этот день принес много положительных эмоций. Вот так прошел мой праздник 8-е марта.",1,10.666666666666666,0.734375,4.390625,0.7872340425531915,357.6278859212313
68,68.0,"В прошлом августе я поехал в Киев к двоюродной тетке. Самое приятное то-что она старше меня всего на 2 года и неделя была многообещающей. В том смысле, что было с кем повеселиться, а не то, о чем вы подумали. Первые 3 дня мы бухали на пропалую на 4 день решили сделать перерыв и съездить в деревню к родственникам, еще более дальним. По приезду мы зашли к бабе Маше, приперли ей кучу подарков, попили чай и сходили на речку. Так как я был в 10 классе и пора было определяться с профессией и жить в городе я не намеревался мы решили, что стоит сходить в колхоз и посмотреть на рабочих. Больше всего мне понравилась незамысловатая работа тракториста и для себя я наметил четкий путь, что немаловажно для меня. Вообщем, я и видел плюсы этой работы-бухать можно было день и ночь, чем я собственно и занимался оставшееся время. ",1,18.22222222222222,0.6585365853658537,4.128048780487805,0.8333333333333334,363.5116598079561
69,69.0,"Настал март, и я с нетерпением начала ждать свой 19-ый день рождения. И вот на календаре долгожданная дата: 18 марта. Если б вы только знали, какое счастье свалилось на меня. С самого утра посыпались поздравления. А разбудило меня робкое тявканье чудесного щенка, о котором я давным-давно мечтала. Сюрпризы продолжались один за другим. На кухне меня ожидал приготовленный папой завтрак, что бывает крайне редко. Но так как погода была далеко не самая весенняя, настроение мое дало слабинку.Папа ушел на работу, мама тоже по своим делам и тут мою голову посетила мысль, что вот собственно и весь праздник. На вечер были намечены гости и я занялась готовкой. Только лишь пушистый комок Пушок не давал мне грустить и радовал глаз. После приготовления праздничных блюд я почувствовала легкую усталость и решила прилечь на часок. Легким поцелуем меня разбудила мама и сказала готовиться к приходу гостей. Я надела свое любимое розовое платье, с огромным бантом сзади, заколола красиво волосыи принялась сервировать стол. Вот и первый звонок в дверь, а за ним и второй... Цветы, подарки, куча добрых слов... Все это было безумно приятно. Посидели в кругу близких и родных мне людей. Около 10 все начали расходиться. Как ни крути, но я все-таки устала. Поручили посуду мыть папе. А я отправилась спать.",1,11.476190476190476,0.7053941908713693,4.522821576763485,0.8823529411764706,277.8546712802768
70,70.0,"С нетерпением я ждала день своего рождения и вот он настал. С самого утра в мой адрес поступали поздравления. План моего дня был обычный: университет, дом. В университете было все как обычно, до момента, когда мои одногруппницы не накинулись на меня и не стали поздравлять меня. Затем они сказали, что меня ждут сюрпризы. Это была интрига! И вот он первый подарок: отменили пару. Мы с девчонками пошли в буфет, набрали всяких вкусностей и начали типа немножко праздновать мое совершеннолетие. В один прекрасный момент они исчезли. Я и подруга, которая осталась со мной решили пойти в наш корпус, т.к. время приближалось к началу следующей пары. Войдя в аудиторию меня ждал сюрприз: все в сборе. Они поздравили меня и пара началась. К моему удивлению, учебный день длился долго, а вечером моя сестра и близкие друзья ждали меня в кафе. Мы праздновали очень долго: пели, танцевали, веселились, а когда администратор узнал, что мы празднуем День рождения, в честь этого за счет заведения предоставили бесплатный торт. И спустя некоторое время, все подходило к концу и вот он... сюрприз очередной: нам не принесли счет, сказали, что для посетителей такого рода как мы весь наш заказ оказался бесплатным (ну или за счет заведения).",1,15.866666666666667,0.6218487394957983,4.3277310924369745,0.8040540540540541,393.5354273192111
71,71.0,"Моя история жизни ничем не примечательна. Я родилась в небольшом сельском поселке где-то в середине 95 года. У меня не было богатых родственников или особого социального статуса; я просто была обычным ребенком в обычной семье. В 10 лет мои родители развелись, и это было не самое лучшее время. Я почти не помню, что чувствовала тогда: в основном о моих выходках мне рассказывала моя мама. Но единственное, что я запомнила хорошо, это голод. У моей матери есть высшее образование, но она никогда не пользовалась им. Откровенно говоря, она не идеал жизни для меня, но я люблю ее. Несмотря на ее поздние визиты домой, иногда с неприятным алкогольным шлейфом. Я люблю ее, потому что она единственная, кто не бросил меня тогда, хотя причины были. Сейчас, оглядываясь в прошлое, я понимаю, что причина моих нервных срывов была в том, родители не могли найти общий язык, а я хотела, чтобы у нас все было как у всех. В 12 лет у меня начались проблемы с одноклассниками. Я никогда не была общительной и заинтересованной в новых знакомствах и больше времени я молчала. Из-за этого меня считали странной. Усугубило эту ситуацию еще и то, как я выглядела:( сама-то я не помню, но фотографии сохранились). Я была очень худой как мама говорила,""скелетон ходячий"", с 11-12 лет у меня начали выпадать волосы, а затем на лице появились эти венки под глазами. Однако несмотря на то, что мне завидовали некоторые девочки ( в том, что я была худой), я все равно считала себя некрасивой и чувствовала себя неуютно в компании, где меня не очень хорошо знали. Я не носила юбки ( да и сейчас не ношу), я боялась показывать руки, и ненавидела лето за то, что приходилось раздеваться перед людьми из-за жары. Однажды даже меня (по настоянию мамы) привели в лечебницу (для диагностики псих.состояния), где к счастью для меня мне поставили диагноз, связанный с чем-то гормональным. Долго лечили как мою тетку. И в итоге они победили, я растолстела и стала стесняться еще больше. Трудно поверить человеку, у которого нет проблем с внешностью, когда он говорит тебе: ""Да все хорошо, ты красивая"". А ты подходишь к зеркалу и понимаешь, что никогда не будешь счастлива и никто не примет тебя такой. В моей жизни (до поступления в университет) не было определенных целей, и я не знала, чего хочу от нее. Единственное, в чем я была уверена, это то что я не хочу расставаться с мамой. Мне было страшно думать о будущем. А потом умер отец. По правде говоря, я не очень сожалею об этом: я почти не знала его. Мама говорила у него была другая семья, но у них вроде бы ничего не получилось. Теперь я сдесь; без матери, без денег, без стипендии, без друзей. Очень нелегко убеждать себя каждый день в том, что я сама самодостаточна и мне не нужен никто, чтобы быть счастливой. Ведь это не так. Вот это факт. И от этого хочется плакать. Но каждое утро ты встаешь и говоришь себе:""Когда-нибудь все наладится"" и делаешь то, что от тебя ждут. ",1,16.694444444444443,0.4908485856905158,4.011647254575707,0.7661016949152543,701.6374604998564
72,72.0,"Я не умею радоваться жизни, может потому, что в ней нет счастливых моментов. Я люблю сидеть дома и читать книги, редкие издания редких авторов. Это моя повседневная жизнь. Но бывают и праздники, которые тоже не могут заставить быть счастливой. Таким был мой день рождения. Мне исполнилось 18 лет, вроде бы такая дата,но для меня это был обычный день. Родители, конечно поздравили и даже подарили мне подарок (постельное белье), но я ожидала чего-то большего в этот день. Я как всегда пошла в школу, но т.к. с одноклассниками я не очень хорошо общаюсь, меня никто не поздравил. Зато мне весь день звонили родственники с поздравлениями и пожеланиями. Так и прошел мой маленький беззаботный, обычный день, день моего рождения.",1,14.2,0.6408450704225352,4.28169014084507,0.8241758241758241,498.73203719357565
