,ID,Text,Truth,Avg_sent,TTR,Avg_word,Hapax,Yules
54,54.0,"Проснувшись утром, я поняла, что не выспалась. Но мне пришлось встать, потому что в этот день должен был быть очень важный тест. Поставив чайник, я присела на стул, взяла собаку на руки и стала ждать, пока вскипит чайник. Когда чайник почти вскипел, я поставила собаку на пол, взяла чашку, насыпала туда 3 ложки кофе, 2 ложки сахара и стала ждать пока чайник вскипит и выключится. Он вскипел, выключился я налила воду в чашку, потом добавила молоко, выпила все это и пошла в душ. После душа, собравшись, я вышла из дома немного опаздывая на занятия. Прийдя на остановку и не обнаружив там своей маршрутки, я стала ждать. Ждала минут 10. Она приехала, я села и через 20 минут я была в университете. На крыльце я встретила одногруппника и мы вместе пошли на пару. Поднявшись на 3 этаж, мы встретили нашу одногрупницу и мы втроем пошли к кабинету. Прозвенел звонок и мы вошли в аудиторию. Долго ждали преподавателя. Пока его не было, я вспомнила, что перед зеркалом в ванной я подумала, что что-то сегодня произойдет и теста не будет. Так и произошло. преподаватель пришел ближе к середине пары и тест отменил. Прошла обычная пара, потом еще две. Весь день я думала только о том, чтобы поскорей приехать домой и лечь спать. Мы с другом вышли из университета, дошли до остановки, и как раз подъехал наш автобус. Мы сели в него и доехали до станции Ховрино. На станции мы немного поговорили и разъехались по домам. Прийдя домой. я почувствовала себя счастливой, потому что знла, что сейчас лягу спать. Пообедав и выпив кружку чая, я легла спать. Проснулась я в 6 вечера. Мне позвонила подруга и пошли гулять с моей собакой. Обсуждая планы на лето, мы погуляли 30 минут, и я пошла домой. Дома я доделала задание по архитектуре, потом помотрела фильм ""Ешь, молись, люби"", подумала, что главная героиня на меня похожа (поведением, внутренними переживаниями).. С мыслями о своей жизни и дальнейшими планами я легла в кровать. В голову мне пришла мысль попутешествовать, как главная героиня фильма ""Ешь, молись, люби"" и найти, или попытаться найти себя. С этими мыслями я и уснула. ",0,11.970588235294118,0.5798525798525799,4.292383292383293,0.8347457627118644,602.7362826773915
55,55.0,"Это день рождения был пару лет назад. По началу он проходил как обычный день в лагере: подъем с детьми, зарядка, выполнение всего порядка дня. Как то пока гуляли с детьми на детской площадке мы вожатые сидели в беседке и делали декорации на сегодняшний концерт. Спустя пару часов мне уже стало казаться, что про мой день все забыли, но не тут то было! Внезапно из-за спины начала слышать какую-то праздничную песню, оборачиваюсь, а там оказывается собрались все мои старые пионеры, вожатые, а и просто друзья. В руках у них были праздничный плакат (нарисованный очень орегинально), куча шариков и конечно же подарки. Как то они меня спрашивали чего же я хочу, но я сказала что мне ничего не надо и они вышли из этой ситуации. Они подарили коробку конфет, вафельный тортик и вкусный чай, обосновав этот выбор тем, что я очень люблю сладкое. Но на этом поздравления не окончены. У нас вечером был концерт, после кот. весь лагерь кричал ""С Днем рождения!"" Было очень приятно. Так что на этом мой самый лучший день был окончен.",0,14.25,0.6666666666666666,4.587719298245614,0.7763157894736842,387.8116343490305
56,56.0,"Было 31 декабря. Полным ходом шла подготовка к Новому Году. Мы убирали квартиру и готовили салаты. Праздник мы собирались встречать с друзьями, родители уезжали на дачу. Мой молодой человек пригласил двух  друзей, и я подругу с парнем. Ожидая гостей я долго прихорашивалась, завивала волосы, красилась, хотела сделать много фотографий. Моя подруга Алена с парнем Ромой приехали раньше всех и составили мне компанию. Еще до отъезда Вовина сестра Лена умудрилась проявить свою мелочность, застелив диван, на котором мы собирались сидеть. Я только многозначительно переглянулась с подругой, я ей рассказывала о ""причудах"" сестры. Вовика друзья не пожелали приехать вовремя и Новый год мы встречали вчетвером. Это немного расстроило меня. потому что я не люблю, когда гости приезжают после 12. Но моя лучшая подруга была рядом, поэтому ябыла рада. Мы съели по 12 виноградинок и загадали желание. Потом позвонили родным, написали СМС друзьям, которые не присутствовали с нами. Кушали салаты и приготовленное горячее. Чуть позже часа в 2 к нам приехал Вовин друг Артур со своими знакомыми в костюме Деда Мороза. Они по-быстрому поздравили нас, выпили и уехали. Настало время ожидания. Второй друг приехал чуть позже, да не один. С собой он притащил двух девок с Вовиной группы, которых я не переносила. Сказать, что я была в ярости, это ничего не сказать. Пришли они не спокойно, с порога начали орать: ""Почему так тихо?! С Новым годом!"" и тому подобное. Плюс ко всему моя подруга умудрилась рассориться с парнем из-за того, что его поздравила по телефону какая-то девка. Мой молодой человек ""гостеприимный хозяин"" накормил этих незваных гостей, из комнаты слышались смех и громкие крики. Мы с подругой сидели в смежной комнате и злились. Я на гостей, она на парня. К счастью, надолго они не задержались, но нервов я потрепала себе изрядно. Еще больше я разозлилась, когда узнала. что друг их привел по причине, что Вова ""шутя"" их пригласил. В итоге я надолго запомнила этот Новый год, в основном негативными воспоминаниями. ",0,10.608695652173912,0.6270491803278688,4.487704918032787,0.7777777777777778,446.4095006194199
57,57.0,"Недавно у нас в университете был праздник - ""Масленица"" - очень крутой день был. Сначала мы расстроились, что было холодно. Пока все выносили на улицу - замерзли. Потом начали подходить люди, стало веселее. Мне принесли какую-то огроменную кастрюлю и половник. Оказывается там был ""сбитень"" (традиционный напиток на масленницу). Все подходили и пили, гуляли, участвовали в конкурсах и веселились. Было прикольно и обалденно. А скоро у нас будет Краса. Надеюсь будет так же весело.",0,9.0,0.6349206349206349,3.7936507936507935,0.8,565.625
58,58.0,"На 8 марта я отправилась к своей любимой подруге Леночке. Я пришла к ней со своим любимым молодым человеком, мы ей устроили праздник! Купили цветов и вина. Она запекла мясо в духовке. Мы долго сидели и разговаривали про жизнь, про любовь, про политику, про животных (у нас у всех есть собаки). Потом включили телек и смотрели праздничный концерт. Правда, нам он не понравился и мы пошли в парк гулять. Конечно, мой молодой человек устал и мы его отправили домой. А с Леночкой еще долго гуляли и мечтали о высокой любви.",0,19.333333333333332,0.6781609195402298,4.333333333333333,0.8135593220338984,271.4737144498707
59,59.0,"Ночь с 7 на 8 марта. 8 марта текущего года прошел достаточно интересно. В ночь с 7 на 8 марта я с подругами пошла в один из популярнейших и дорогих клубов Москвы, вход в который был для нас бесплатным, посколько буквально за день до мероприятия мы успели внести себя в список приглашенных. В клубы ходить я не очень люблю, и поэтому делаю это крайне редко: раз-два в год максимум. Но впечатления от клуба остались положительные, очень много интересных воспоминаний осталось. После выхода из клуба, мы вызвали такси, чтобы поехать домой, т.к. метро было закрыто, ожидая такси мы встретили парней, которые были заинтересованы в знакомстве с нами, они подошли к нам знакомиться с букетами тюльпанов в руках для каждой. Это было очень мило, и неожиданно и безумно приятно. После этого момента ко мне пришло осознание того, что есть еще парни, которые способны делать различные приятности незнакомым девушкам просто так. ",0,14.0,0.6984126984126984,4.785714285714286,0.7954545454545454,281.5082644628099
60,60.0,"23 февраля я проснулся, позавтракал. Получил поздравления от близких, поздравил своих друзей, знакомых. После отправился в торговый центр ""Амин"" за покупками. На вечер этого дня со своими друзьями отмечал праздник в ресторане ""Троица"". Вечером я вернулся домой.",0,18.5,0.8108108108108109,4.945945945945946,0.9,455.55555555555554
61,61.0,"Все 8 марта я провела в салоне красоты. Мы сидели на консультациях и посещали процедуры красоты. После этого нам раздали шампанское, конфеты, включили телевизор и мы получаем удовольствие. Еще мне лично салон бесплатно сделал массаж на 15 минут. Это было впечатлительно. После чего мне не хотелось уходить и мы просидели до вечера.",0,14.166666666666666,0.611764705882353,4.1647058823529415,0.7788461538461539,477.07100591715977
62,62.0,"Дело было в пятницу. День начался довольно приятно: за окном солнце, а самое главное я выспался. Простой завтрак, и я поехал на Петровско-Разумовскую, так как в 10 часов договорились о занятиях по вождению. Практика на механической коробке передач, седьмая по счету, и все с переменным успехом. Прождал 15 минут на месте, где преподаватель каждый раз меня забирал, позвонил ему - решил узнать в чем дело. Итогом ему стала информация о том, что он уволился из школы, и я нахожусь в свободном плавании. Звонок в автошколу и мне скинули номер нового инструктора, который будет на новой машине, а не на старом тяжелом Фольсквагене. А потом ждал подтверждение информации от администрации автошколы, наткнулся в МВидео на знакомые колонки. Точно такие лежат на рабочем месте, в студенческом совете, сломанные правда. Вещей с собой практически не было, ехал в универ налегке, так как днем ранее ездил на матч ЦСКА-Терек в Химки, и вещи оставил в универе, чтобы не таскаться с ними везде. По приезде зашел к начальнику и увидел краем глаза служебку на премирование за успешное проведение мероприятия. Очень вовремя - деньги сейчас не помешают. На парах дорисовал портрет знакомой девушки, довольно неплохо получилось. И она восприняла его тоже довольно положительно. Шикарная брюнетка с непредсказуемым характером. ",0,13.277777777777779,0.6276150627615062,4.2384937238493725,0.8533333333333334,386.22222222222223
63,63.0,"Я очень люблю свой день рождения, поэтому этот день всегда очень жду. В этом году было самое замечательное празднование. Я очень тщательно и долго готовилась к нему. В этот ожидаемый день я проснулась очень рано, мне не спалось. Моя вечеринка была в стиле ковбой - party. Мы купили шляпы, рубашки в клетку, вообщем все было как надо. Ну вот мы поехали на пункт назначения. Все было супер, погода очень радовала, светило ярко солнце и было очень тепло. Приехав, мы начали накрывать стол, готовить салатики. Звучала замечательная музыка. Все танцевали, веселились. Но тут нам стало холодно, и мы решили растопить печь. Видимо с печью было что-то не так, и весь дым оставался в помещении. Дыма стало настолько много, что в комнате нельзя было оставаться - это было невыносимо. И нам пришлось выйти на улицу и продолжать праздновать там. Но слава богу, вскоре все нормализовалось и мы смогли вернуться в помещение. И тут мне начали дарить подарки и еще больше звучало поздравлений. Мне подарили ролики, о которых я так мечтала. ",0,10.466666666666667,0.643312101910828,4.305732484076433,0.8613861386138614,543.0840113714341
64,64.0,"Я родилась в Москве. Это самый замечательный город и я его очень люблю. С 6 лет я занималась спортом. Какие виды спорта я только не пробовала. Самый первый спорт которым я начала заниматься - легкоя атлетика. После долгих месяцев тренировок я поняла, что этот спорт не для меня. Потом неожиданно для себя я начала заниматься плаванием. Очень долго занималась этим видом спорта. Но после некоторых событий я перестала заниматься плаванием. Долгое время я была домоседкой, особо никуда не ходила и ничем не занималась. В 10 лет я начала увлекаться рисованием. И поэтому решила пойти в художественную школу Все 11 лет я прозанималась рисованием и закончила школу с отличием. Но вот в обычной у меня были проблемы с учебой. С 9-11 классов я занималась с репетиторами, чтобы подтянуть свою учебу. В итоге школу я закончила хорошисткой. А теперь я учусь в московском университете. Мне тут очень нравится я нашла тут много новых друзей . В университетской жизни более интересно, чем в школьной жизни. Тут очень много мероприятий, в которых я иногда являюсь организатором. Теперь остается закончить университет на ""отлично"" и устроиться на работу.",0,9.529411764705882,0.6049382716049383,4.722222222222222,0.7244897959183674,501.87421907538527
65,65.0,"На самом деле за день до эксперимента я была дома с утра мне стало плохо (болел живот) я выпила обезболивающее, позвонила подруге и сказала в универ я сегодня не приду, легла в постель и проспала до 16.00. Потом пришла сестра и приготовила мне завтрак, хотя уже надо было ужинать. Я встала поела и начала собираться на работу. Перед выходом из дома мне стало опять плохо и я напилась таблеток и поехала на работу. Приехав на работу ночь прошла в принципе не плохо; не считая того что мне сказали, что могут перевести меня в дневную смену, а это очень плохо т.к. мне придется уволиться чего сделать я не могу, либо пропускать учебу, что тоже очень плохо. После того как наконец закончилась эта дурацкая работа. Я приехала в ТЦ позавтракала и чуть не заснула за столиком, но в итоге напилась кофе и поехала на 2 пары. А теперь сижу и пишу для вас этот тест.",0,15.5,0.6709677419354839,4.367741935483871,0.8365384615384616,354.10502958579883
