,ID,Text,Truth,Avg_sent,TTR,Avg_word,Hapax,Yules
107,107.0,"Как я провела лето. В начале июля у меня начались каникулы. Была сдана сессия на отлично и я уехала на практику на атомную электростанцию. Я работала штукатуром-маляром. Было очень весело. Очень много появилось знакомых. Друзей. Последние две недели я очень хотела домой, т.к. очень устала, но все-таки осталась, т. к. не хотела подводить ребят. Мы ходили гулять по городу, в караоке-клуб. Приходили домой в середине ночи. Можно сказать, что ""под утро"". Вставали на работу в 6 часов утра, и до самого вечера работали. И так продолжалось целый месяц. После этого я уехала на море с родителями и младшим братом. Эта неделя пролетела незаметно. Море... солнце...пляж... Красота! Была на экскурсиях, ходили в ресторан, отдыхали в общем. Через неделю отдыха я приехала домой. Съездила в гости к бабушкам и дедушкам. И так прошли мои каникулы. Началась опять учеба. Сессия. Я так хочу обратно лето... ",0,8.89655172413793,0.5658914728682171,3.864341085271318,0.7945205479452054,711.202852317508
108,108.0,"Вчерашний мой день начался со звонка будильника. Поднявшись утром , как обычно, я стал заправлять постель. После, пошел в ванную комнату. Там умылся и почистил зубы. Потом пошел на кухню, приготовил чай и бутерброд. Стал собираться на учебу. Оделся, закрыл дверь, отправился на автобусную остановку. Приехал в университет. Отсидел пары. Приехал домой, приготовил поесть. Посмотрел телевизор. Сделал уроки. Лег спать.",0,10.909090909090908,0.6833333333333333,4.475,0.8658536585365854,452.11183819155264
109,109.0,"Знакомство с родителями. Встретились мы у него дома. Нас встретили его родители, на первый взгляд мне показалось, что это очень добрые и отзывчивые люди. Но как показало время (6 лет) это не так. Его мама зацыклилась только на себе и своих собаках. В ее семье 3 мужиков, но это не повод готовить. Готовит она исключительно по праздникам. Дети вечно голодные. Дома грязно, пыльно, бегают эти замызганные собаки, от них вечно воняет. Как она говорила что собак она заводила для себя. Но это не так, выгуливают этих псин исключительно сыновья. Мы живем отдельно от его родителей 2-ем. Так ее это бесит, что ее 22 летний сын ночует не дома. Она делает вид, что помогает своим сыновьям, но это только вид, любит эта женщина пригубить, на выходных я ее трезвой не видела.",0,9.333333333333334,0.7380952380952381,4.059523809523809,0.8064516129032258,338.1893860561915
110,110.0,"Добрый день дорогие друзья мне бы хотелось вам рассказать историю знакомства со своей лучшей подругой, итак 2 года назад я искала квартиру, т.к. одной снимать ее сложно, да и вдвоем как говорится  веселее, я решила, что мне нужна сожительница, выбора было на самом деле много, но я понимала, что уже из знакомых мне людей я ни с кем не ""уживусь"", т. к. характер собственника, а (подругу обидеть или указать на что, то я не смогу). И вдруг папа мне предлагает дочку своего хорошего друга, с которой лично я не была знакома, только на словах. Хоть мы и были из одного города. В один из летних дней она приехала ко мне, со своим папой для поиска квартиры. Внезапно он уехал по делам и мы остались вдвоем. Изначально честно сказать мне эта девочка показалась очень скромной, молчаливой и слегка забитой. Я начала общение и как-то слово за слово мы не заметили как прообщались 3 часа. Мы были совершенно разные, но и в тот же момент очень похожи. И вот прошло уже 2 года, за которые мы ни разу не разошлись во мнениях по поводу нашей жизни совместной. Для меня она стала очень близким человеком. Я благодарна судьбе за такой подарок! P.S.Спасибо обстоятельствам, я бы даже сказала сложному этапу в моей жизни, но он дал мне очень хорошего человека. ",0,14.466666666666667,0.6221198156682027,3.857142857142857,0.8222222222222222,440.0548696844993
111,111.0,"Меня зовут Аня. Мне 20 лет. Я родилась в городе Воронеж. Сейчас живу с мамой и папой. Раньше мы жили с бабушкой и дедушкой. Они умерли. И мне очень плохо без них. У меня есть парень. Ему 22 года. Вместе мы уже больше 3 лет. Было много разного за это время. Он работал в Москве, а я училась в 11 классе. Мне тогда хотелось гулять с ним, ходить в клубы, кафе, тусовки, как это делали мои подруги, но он был далеко. Потом он ушел в армию. Решил меня бросить перед ней, говорил, что так легче. Он боялся что я его не дождусь. Но я решила дождаться. Через месяц его службы мы помирились и я как угорелая понеслась в его часть. Потом его перевели на взрывы, но это было ближе к дому. Я получила права и каждые выходные моталась к нему. Все было отлично. Конечно иногда мы ругались, со всеми бывает. Он пришел с армии, этот день я не забуду никогда. Я сидела на паре. Пришла СМС ""Код домой навсегда"". Я заплакала аж, хотя никогда не разделяла эти армейские сопли. Сейчас мы вместе. Он уже ждет когда я закончу учебу, хочет свадьбу. Я учусь. Люблю учиться. Получаю сразу два высших образования. Люблю его, маму, папу, дедушку, бабушку и своих собак. Собаку он мне подарил маленькую, домашнюю. Ее зовут Челси. Во дворе живет Лаки. Ему уже 14 лет. Летом родились во дворе щенки. Я пыталась раздать, 2 остались. Неделю назад их потравили соседи. Я видела, как они мучительно умирают, трясутся в конвульсиях, но ничего не могла сделать. Их вывезли в лес. Но через 2 дня одна собачка вернулась, приползла. Еле живая. Мы с родителями отходили ее. Бегает. Боюсь, что опять с ней что-то сделают.",0,9.622641509433961,0.5098039215686274,3.996078431372549,0.7615384615384615,767.4556213017752
112,112.0,"Однажды вечером мама загадочно обратилась ко мне. Я даже и подумать в ту секунду не могла, что может она мне предложить. Поездка в Чехию! Я была счастлива. Начала собирать документы, готовиться. Наконец все было готово, осталось ждать дня вылета, до него было еще месяц, но я четко осознала, что пусть я еду всего лишь на неделю, но на это время мое сердце остается здесь. Я очень люблю маму и всех своих родных и близких, но эту любовь не сравнить с той, что чувствую к молодому человеку. И пусть было еще много времени я поняла как буду скучать. Как я бы хотела взять его с собой, но прекрасно понимала, что не могу. Наступил день отъезда я была рада, но в сердце закралась небольшая грусть. Приехав туда, видя всю красоту этой страны, попав в сказку, ту, о которой всегда мечтала увидеть и ни на секунду не пожалела, что согласилась. Я уже путешествовала и обожаю это делать, но тогда мое сердце не было так привязано к молодому человеку, его тогда просто не было в моей жизни. И я с легкостью собиралась в любое путешествие. Но теперь я хочу все радости делить с ним и когда я смотрела всю эту красоту, я хотела, чтобы и он ее видел. Я очень скучала, хотя это было замечательное путешествие, к-е я никогда не забуду, ведь это была моя мечта побывать в этой сказочной стране. Но сказка пролетела быстро и мое сердце предвкушало встречу. Увидев его в аэропорту, я поняла, что скучала больше, чем думала и готова была бежать, минуя все контроли. Наконец пройдя их все и воссоединившись со своей частью, я ощутила полную гармонию. Все таки главное в этой жизни быть любимой и любить.",0,12.347826086956522,0.5985915492957746,4.165492957746479,0.8235294117647058,447.75086505190313
113,113.0,"У вас очень трогательная история. А я еду с экскурсии по Золотому кольцу России. Мне очень понравилось! После этой поездки я начала еще сильнее ощущать свою любовь к стране, трепет к тому, что во всем мире ассоциируется с Россией (матрешки, березки, поля, гимн, флаг и др.) и гордость, гордость за то, как сильно люди любят свой дом, как духовно радуются походам в церковь, собор и т.д. Как детям с детства прививают слово ""Родина"","" мама"". Как люди плачут, слушая гимн, как ветераны воспитывают своим опытом новое поколение. Как только окунаешься в атмосферу подлинной России, так еще больше отдаешь все свои силы, энергию и эмоции на ее подъем и развитие. Сейчас я хочу отправиться куда-то в Сибирь и узнать, как живут россияне там, какие у них традиции и обычаи. Надеюсь, что мое изучение нашей страны на этом не закончиться, я еще не раз смогу  насладиться тем, что так дорого моему сердцу.",0,20.333333333333332,0.6598360655737705,4.450819672131147,0.8322981366459627,345.27988889317544
1,1.0,"Решили мы в субботу отметить день рождения друга. Собрались где-то часов в пять вечера, взяли продуктов, гитару и палатки, подруг и поехали на речной берег. Весь вечер мы танцевали, рассказывали шутки, пели песни под гитару. Мы разожгли очень большой, красивый костер, вокруг которого мы просидели всю ночь. Под утро. многие захотели спать и пошли по своим спальным местам. Отдохнув, было решено, поехать на турбазу всей нашей компанией. Но на турбазе свободных мест не оказалось, и мы разъехались по домам.   ",1,10.777777777777779,0.7010309278350515,4.422680412371134,0.8676470588235294,477.94117647058823
2,2.0,"Вчера я работала над собой. Я делаю это каждый день. Я начинаю день с того, что выпиваю йогурт с овсяными отрубями и выхожу на пробежку. Потом я решила повторить вчерашнюю лекцию по теории вероятностей и позвонить родителям. Как всегда прошел обмен любезностями и отец мне сказал, что прилетает через неделю. Мой закадычный друг - журналист пригласил меня на Джазовый фестиваль. Я узнала, что группа ""Caravan"" играет авангардный рок. Потом позвонил мой друг из Москвы и сказал, что он едет ко мне в гости. Я отношусь к этому спокойно и продолжаю готовиться кристаллографии.",1,11.88888888888889,0.7102803738317757,4.5233644859813085,0.8289473684210527,334.14127423822714
3,3.0,"Приехав в Питер, мы сразу поехали в квартиру, которую мы забронировали, она была в центре города, прямо на Невском, прямо из окна можно было видеть красивые пейзажи Питера, особенно вечером, когда солнце садилось, было очень красиво. Конечно гулять в этом городе можно бесконечно и это не надоест, пока гуляешь непроизвольно радуешься всему что тебя окружает. Каждый вечер мы колесили по городу по разным заведениям, однозначно таких клубов и пабов у нас в городе еще нету и долго не будет. Невероятное настроение получаешь от этого города. ",1,19.8,0.7272727272727273,4.606060606060606,0.8333333333333334,337.57716049382714
4,4.0,"Вчера я проснулся дома в хорошем настроении. Умылся, пошел на пробежку утреннюю. Зашел домой, сходил в душ, покушал. Начал делать домашние задания по английскому языку. Весь день я играл в приставку. Ближе к вечеру я позвонил к девушке, позвал в кафе. Вечером я пришел домой.",1,8.0,0.6964285714285714,4.125,0.8461538461538461,650.887573964497
5,5.0,"Я говорю брату держи бутылку пива на готове, если что будем бить. Выходим мы с магазина, пацаны говлорят пойдем отойдем поговорим. Я говорю. Что у нас нет желания общаться, да и к тому же мы спешим. Один из парней достает резко что-то из кармана. И я сразу разбиваю ему об голову бутылку, тот падает. кровь идет. Его друзья моментально начали убегать. Брат за ним побежал, но не догнал. В итоге тип этот извинился и мы дальше пошли бухать.",1,9.3,0.7526881720430108,3.89247311827957,0.8714285714285714,324.48979591836735
6,6.0,"Ночью мне снилось, будто Стивен Фрай рассказывал мне об инверсионных осях четвертого порядка. Вообще он снится мне уже третью ночь, до этого были ""Стивен Фрай и волновые функции"" и ""Стивен Фрай и теория вероятностей"".Проснулась часов в 10 утра, болела голова. Договорилась с матушкой, что пойдем с ней вдвоем по магазинам, искать мне новое пальто. Подумала о  том, что неплохо было бы перечитать всего Ренуара, только на этот раз в хронологическом порядке. матушка приготовила щи с квашеной капустой и я ей в этом, в отличие от прошлого воскресенья не помогала. Потом она попоросила меня вычесать, наконец, кота, но он на этот раз остался лохматым, ибо он очень не любит, когда я начинаю подходить к нему со счеткой. Потом в дверь позвонили ""Свидетели Иоговы"", но я послала их куда подальше. Потом мне написала моя бывшая одноклассница из Питера. Это было удивительно, ведь общение наше прервалось несколько недель назад без видимых причин, а теперь также внезапно возобновились.",1,20.666666666666668,0.6935483870967742,4.467741935483871,0.8449612403100775,290.2469803497386
7,7.0,"Значит мы с друзьями собрались, набрали денег и поехали в Дубай. Там мы катались на машинах, таких как Сhevrolet corvet zn, Ломброджина. Вскоре разумеется игры нам надоели. Мы это все расхреначили. Потом мы прыгнули с самолета забыв парашют внутрои него. Поля летели хавали лицом воздух. Потом мы удачно приземлились в воду с высоты где-то метров 700 и начали обуздывать подводные глубины. Там мы познакомились с множеством рыб, пообщались с акулами и конечно же покормили их. Потом решив погулять на последние деньги мы пошли в местный бар и ужрались там. Самый незабываемый день.  ",1,9.636363636363637,0.6981132075471698,4.622641509433962,0.8783783783783784,416.3623082542002
8,8.0,"Проснувшись этим утром я почувствовал дикий сушняк, я с трудом встал и начал искать чем бы утолить свою жажду. Под руку попалась только бутылка с водопроводной водой , стоявшая на подоконнике. Но на это было все равно. Я залпом вымутил пол бутылки и плюхнулся на кровать. За окном было солнечно. Утолив жажду, я принялся вспоминать, что было вчера. Прервала мои мысли тупая боль в затылке. Я рукой взялся за затылок, там была застывшая кровь, к счастью немного. Я вспомнил вчера, когда я вышел из бара ктото ударил меня. Обернувшись я понял, что это был асфальт. Я обернулся снова, асфальт лениво потупился на меня. Да, надо же было так напиться. Мои размышления прервал стук в дверь. Это была хозяйка дома, в котором я снимал комнату. ""Вставай, дармоед""- ворчала она.""Опять вчера наклюкался"".""Здоровый вымахал кабан, а ума нет..."" Я не отвечал,поорет, да уйдет. Говорить мне не очень хотелось. За дверью утихло, наверно ушла подумал я. Я легонько отворил замок и вышел.""Стоять!"" Мой поход прервал властный голос старушки:""Ты когда за комнату платить будешь?"" ""Я заплачу""- оправдывался я. ""Мама денег скоро прислать должна"". ""Ну смотри у меня!""-сказала старушка. ""Мишке спасибо скажи,он тебя вчера приволок"". Я постучал к соседу Михе в дверь, он открыл. Я было хотел сказать, но не успел, он меня опередил.""Очухался? А пойдем на рыбалку, день хороший!"" Я кивнул. Я шел с Михой по теплому палящему солнцу, и наверно впервые за долгое время был счастлив.    ",1,12.192307692307692,0.5772870662460567,3.914826498422713,0.8142076502732241,595.419391441966
9,9.0,"Я встал утром 8 марта специально пораньше чтобы купить подарок своей любимой. Сходил в магазин купил 21 розу(ведь для моей девушки мне ничего не жалко). Затем пришел домой, позвонил любимой , от всего сердца поздравил ее с праздником и позвал гулять. Заехал за ней подарил подарок, созвонился со своими друзьями, у которых тоже есть девушки и всеми  мы поехали ко мне на дачу за город. Все необходимое закупили и отправились отдыхать на несколько дней.",1,17.0,0.8235294117647058,4.447058823529412,0.8714285714285714,132.6530612244898
